{"bootstrapProtocolVersion":1,"desktopPackageLockSha256":"ffffffffffffffffffffffffffffffffffffffffffffffffffffffffffffffff","electronArchiveSha256":"eeeeeeeeeeeeeeeeeeeeeeeeeeeeeeeeeeeeeeeeeeeeeeeeeeeeeeeeeeeeeeee","electronVersion":"0.0.0","frontendHash":"dddddddddddddddddddddddddddddddddddddddddddddddddddddddddddddddd","frontendPackageLockSha256":"9999999999999999999999999999999999999999999999999999999999999999","generation":"g0170","partnerSha":"cccccccccccccccccccccccccccccccccccccccc","productVersion":"0.17.0","rid":"win-x64","schemaVersion":1,"sourceSha":"aaaaaaaaaaaaaaaaaaaaaaaaaaaaaaaaaaaaaaaa","sourceTreeSha":"bbbbbbbbbbbbbbbbbbbbbbbbbbbbbbbbbbbbbbbb","toolchain":{"dotnetRuntimeVersion":"0.0.0","dotnetSdkVersion":"0.0.0","innoCompilerSha256":"7777777777777777777777777777777777777777777777777777777777777777","innoDistributionSha256":"8888888888888888888888888888888888888888888888888888888888888888","innoSetupVersion":"0.0.0","nodeVersion":"0.0.0","npmVersion":"0.0.0","pythonVersion":"0.0.0"},"workflowSha":"dddddddddddddddddddddddddddddddddddddddd"}